alert_id,prima_aparitie_utc,ultima_actualizare_utc,revizuit,content_hash,source,data_emitere,interval_text,interval_start,interval_end,durata_ore,cod_culoare_max,fenomene_pe_cod_json,zona_afectata_text,judete_afectate,judete_count,judete_culori_json,text_alerta_plain,text_alerta_html
general-6ffccc258946acc1,2026-06-29T07:28:45Z,2026-06-29T07:28:45Z,false,b740367afd19,General,2026-06-29T10:00,"1 iulie, ora 10 – 1 iulie, ora 21; 1 iulie, ora 12– 1 iulie, ora 21",2026-07-01T10:00,2026-07-01T21:00,11,2,"{""1"":""val de căldură persistent, temperaturi deosebit de ridicate, disconfort termic ridicat"",""2"":""val de căldură intens și persistent, local caniculă, disconfort termic accentuat""}",conform textelor și hărții,"AB,AR,BC,BH,BN,BR,BT,BV,BZ,CJ,CL,CT,CV,GL,HD,HR,IL,IS,MM,MS,NT,SB,SJ,SM,SV,TL,TM,VN,VS",29,"{""AB"":2,""AR"":1,""BC"":2,""BH"":2,""BN"":2,""BR"":2,""BT"":2,""BV"":2,""BZ"":2,""CJ"":2,""CL"":1,""CT"":1,""CV"":2,""GL"":2,""HD"":2,""HR"":2,""IL"":1,""IS"":2,""MM"":2,""MS"":2,""NT"":2,""SB"":2,""SJ"":2,""SM"":2,""SV"":2,""TL"":1,""TM"":1,""VN"":2,""VS"":2}","MESAJ 3/4
AVERTIZARE METEOROLOGICĂ
COD GALBEN
Interval de val abilitate: 1 iulie, ora 10 – 1 iulie, ora 21
Fenomene vizate: val de căldură persistent, temperaturi deosebit de ridicate, disconfort termic ridicat
Zone afectate: nordul Banatului, sudul Crișanei, sud-estul Munteniei și Dobrogea
Miercuri (1 iulie) valul de căldură va persista, iar în nordul Banatului, sudul Crișanei, sud-estul Munteniei și în Dobrogea se vor înregistra temperaturi deosebit de ridicate pentru această dată, disconfortul termic va fi ridicat, iar indicele temperatură-umezeală (ITU) va atinge pragul critic de 80 de unități. Temperaturile maxime se vor încadra între 31 și 34 de grade, cu valori mai coborâte pe litoral și în Delta Dunării de 27...29 de grade.
COD PORTOCALIU
Interval de valabilitate: 1 iulie, ora 12– 1 iulie, ora 21
Fenomene vizate: val de căldură intens și persistent, local caniculă, disconfort termic accentuat
Zone afectate: nordul Crișanei, Maramureș,Transilvania, Moldova și nord-estul Munteniei
În nordul Crișanei, Maramureș,Transilvania, Moldova și nord-estul Munteniei valul de căldură intens va persista, local va fi caniculă și disconfort termic accentuat, iar indicele temperatură-umezeală (ITU) va depăși pragul critic de 80 de unități. Temperaturile maxime se vor încadra între 32...33 de grade în nordul Moldovei și estul Transilvaniei și în jurul a 37 de grade în nordul Crișanei și în Maramureș.","<p style=""text-align: center;"" align=""\""center\""""><span style=""font-size: small; font-family: verdana, geneva; color: #000000;"" lang=""\""RO\""""> </span></p> <p style=""text-align: center;"" align=""\""center\""""><span style=""font-size: small; font-family: verdana, geneva; color: #000000;""><strong><span lang=""\""RO\"""">MESAJ 3/4</span></strong></span></p> <p style=""text-align: center;"" align=""\""center\""""><span style=""font-size: small; font-family: verdana, geneva; color: #000000;""><strong><span lang=""\""RO\"""">AVERTIZARE METEOROLOGICĂ<br /></span></strong></span><img src=""../wp-content/plugins/meteo//admin/images/galben.gif"" alt="""" align=""absmiddle"" /><strong style=""font-family: verdana, geneva; font-size: small;"">COD GALBEN</strong></p> <p style=""text-align: center;"" align=""\""center\""""><span style=""font-size: small; font-family: verdana, geneva; color: #000000;""><strong><span lang=""\""RO\"""">Interval de val</span></strong><strong><span lang=""\""RO\"""">abilitate: 1 iulie, ora 10 – 1 iulie, ora 21<br /></span></strong><strong><span lang=""\""RO\"""">Fenomene vizate: val de căldură persistent, temperaturi deosebit de ridicate, disconfort termic ridicat<br /></span></strong><strong><span lang=""\""RO\"""">Zone afectate: </span></strong><strong><span lang=""\""RO\"""">nordul Banatului, sudul Crișanei, sud-estul Munteniei și Dobrogea</span></strong><strong><span lang=""\""RO\""""> </span></strong></span></p> <p style=""text-align: justify;""><span style=""font-size: small; font-family: verdana, geneva; color: #000000;"" lang=""\""RO\""""> Miercuri (1 iulie) valul de căldură va persista, iar în nordul Banatului, sudul Crișanei, sud-estul Munteniei și în Dobrogea se vor înregistra temperaturi deosebit de ridicate pentru această dată, disconfortul termic va fi ridicat, iar indicele temperatură-umezeală (ITU) va atinge pragul critic de 80 de unități. Temperaturile maxime se vor încadra între 31 și 34 de grade, cu valori mai coborâte pe litoral și în Delta Dunării de 27...29 de grade. </span></p> <p style=""text-align: center;""><span style=""font-size: small; font-family: verdana, geneva; color: #000000;"" lang=""\""RO\""""> </span></p> <p style=""text-align: center;"" align=""\""center\""""><img src=""../wp-content/plugins/meteo//admin/images/portocaliu.gif"" alt="""" align=""absmiddle"" /><span style=""font-size: small; font-family: verdana, geneva; color: #000000;""><strong><span lang=""\""RO\"""">COD PORTOCALIU</span></strong></span></p> <p style=""text-align: center;"" align=""\""center\""""><span style=""font-size: small; font-family: verdana, geneva; color: #000000;""><strong><span lang=""\""RO\"""">Interval de valabilitate: 1</span></strong><strong><span lang=""\""RO\""""> iulie, ora 12– 1 iulie, ora 21<br /></span></strong><strong><span lang=""\""RO\"""">Fenomene vizate: val de căldură intens și persistent, local caniculă, disconfort termic accentuat<br /></span></strong><strong><span lang=""\""RO\"""">Zone afectate: nordul Crișanei, Maramureș,Transilvania, Moldova și nord-estul Munteniei</span></strong><strong><span lang=""\""RO\""""> </span></strong></span></p> <p style=""text-align: justify;""><span style=""font-size: small; font-family: verdana, geneva; color: #000000;"" lang=""\""RO\""""> În nordul Crișanei, Maramureș,Transilvania, Moldova și nord-estul Munteniei valul de căldură intens va persista, local va fi caniculă și disconfort termic accentuat, iar indicele temperatură-umezeală (ITU) va depăși pragul critic de 80 de unități. Temperaturile maxime se vor încadra între 32...33 de grade în nordul Moldovei și estul Transilvaniei și în jurul a 37 de grade în nordul Crișanei și în Maramureș.</span></p>"
general-8f171d45a7f600b1,2026-06-29T07:28:45Z,2026-06-29T07:28:45Z,false,5feaf1fd678e,General,2026-06-29T10:00,"1 iulie, ora 12 – 1 iulie, ora 23",2026-07-01T12:00,2026-07-01T23:00,11,1,"{""1"":""instabilitate atmosferică, averse însemnate cantitativ""}","sudul Banatului, Oltenia, cea mai mare parte a Munteniei și local zona de munte","AB_munte_1,AB_munte_2,AG,AR_munte,B,BH_munte,BN_munte,BV_munte_1,BV_munte_2,BZ,CJ_munte,CL,CS,CV,DB,DJ,GJ,GR,HD,HR_depresiuni,HR_munte_1,HR_munte_2,IF,IL,MH,MH_munte_1,MH_munte_2,MM_munte,MS_munte,OT,PH,SB_munte,SJ_munte,TM_munte,TR,VL",36,"{""AB"":0,""AB_munte_1"":1,""AB_munte_2"":1,""AG"":1,""AR"":0,""AR_munte"":1,""B"":1,""BH"":0,""BH_munte"":1,""BN"":0,""BN_munte"":1,""BV"":0,""BV_depresiune"":0,""BV_munte_1"":1,""BV_munte_2"":1,""BV_munte_3"":0,""BZ"":1,""CJ"":0,""CJ_munte"":1,""CL"":1,""CS"":1,""CV"":1,""DB"":1,""DJ"":1,""GJ"":1,""GR"":1,""HD"":1,""HR"":0,""HR_depresiuni"":1,""HR_munte_1"":1,""HR_munte_2"":1,""HR_zona_joasa"":0,""IF"":1,""IL"":1,""MH"":1,""MH_munte_1"":1,""MH_munte_2"":1,""MM"":0,""MM_munte"":1,""MS"":0,""MS_munte"":1,""OT"":1,""PH"":1,""SB"":0,""SB_munte"":1,""SJ"":0,""SJ_munte"":1,""TM"":0,""TM_munte"":1,""TR"":1,""VL"":1}","MESAJ 4/4
ATENȚIONARE METEOROLOGICĂ
COD GALBEN
Interval de valabilitate: 1 iulie, ora 12 – 1 iulie, ora 23
Fenomene vizate: instabilitate atmosferică, averse însemnate cantitativ
Zone afectate: sudul Banatului, Oltenia, cea mai mare parte a Munteniei și local zona de munte
Miercuri (1 iulie) în sudul Banatului, Oltenia, în cea mai mare parte a Munteniei și local în zona de munte vor fi perioade cu instabilitate atmosferică ce se va manifesta prin averse torențiale, frecvente descărcări electrice, intensificări ale vântului (viteze la rafală în general de 50...70 km/h) și pe arii restrânse vijelii și căderi de grindină de mici și medii dimensiuni (1...4 cm). În intervale scurte de timp (1...3 ore) sau prin acumulare cantitățile de apă vor fi de 15...25 l/mp și pe arii restrânse vor depăși 30...40 l/mp.
În funcţie de evoluţia şi intensitatea fenomenelor meteorologice, Administraţia Naţională de Meteorologie va actualiza prezentul mesaj .","<p align=""center""><span style=""font-size: small; font-family: verdana, geneva; color: #000000;""><strong><span lang=""RO"">MESAJ 4/4<br /> ATENȚIONARE METEOROLOGICĂ<br /> </span></strong></span><img src=""../wp-content/plugins/meteo//admin/images/galben.gif"" alt="""" align=""absmiddle"" /><span style=""font-size: small; font-family: verdana, geneva; color: #000000;""><span lang=""RO""><strong>COD GALBEN<br /> Interval de valabilitate: 1 iulie, ora 12 – 1 iulie, ora 23<br /> Fenomene vizate: instabilitate atmosferică, averse însemnate cantitativ<br /> Zone afectate: sudul Banatului, Oltenia, cea mai mare parte a Munteniei și local zona de munte</strong></span></span></p> <p align=""center""><span style=""font-size: small; font-family: verdana, geneva; color: #000000;""><strong><span lang=""RO""> </span></strong></span></p> <p><span style=""font-size: small; font-family: verdana, geneva; color: #000000;"" lang=""RO""> Miercuri (1 iulie) în sudul Banatului, Oltenia, în cea mai mare parte a Munteniei și local în zona de munte vor fi perioade cu instabilitate atmosferică ce se va manifesta prin averse torențiale, frecvente descărcări electrice, intensificări ale vântului (viteze la rafală în general de 50...70 km/h) și pe arii restrânse vijelii și căderi de grindină de mici și medii dimensiuni (1...4 cm). În intervale scurte de timp (1...3 ore) sau prin acumulare cantitățile de apă vor fi de 15...25 l/mp și pe arii restrânse vor depăși 30...40 l/mp.</span></p> <p> </p> <p align=""center""><span style=""font-size: small; font-family: verdana, geneva; color: #000000;""><strong><em><span lang=""RO"">În funcţie de evoluţia şi intensitatea fenomenelor meteorologice, Administraţia Naţională de Meteorologie va actualiza prezentul mesaj</span></em></strong><strong><em><span lang=""RO"">.</span></em></strong></span></p>"
2e5c0f2f5e0d1948,2026-06-29T08:35:01+00:00,2026-06-29T08:35:01+00:00,false,818e56bc3e6f,general,2026-06-29T10:00,"1 iulie, ora 12 – 1 iulie, ora 23",2026-07-01T12:00:00,2026-07-01T23:00:00,11.0,1,"{""1"": ""instabilitate atmosferică, averse însemnate cantitativ""}","sudul Banatului, Oltenia, cea mai mare parte a Munteniei și local zona de munte",AB;AG;AR;B;BH;BN;BV;BZ;CJ;CL;CS;CV;DB;DJ;GJ;GR;HD;HR;IF;IL;MH;MM;MS;OT;PH;SB;SJ;TM;TR;VL,30,"{""MM"": 0, ""BN"": 0, ""MS"": 0, ""HR"": 0, ""BV"": 0, ""SB"": 0, ""SJ"": 0, ""CJ"": 0, ""BH"": 0, ""AR"": 0, ""TM"": 0, ""AB"": 0, ""HD"": 1, ""CV"": 1, ""BZ"": 1, ""IL"": 1, ""CL"": 1, ""PH"": 1, ""AG"": 1, ""DB"": 1, ""IF"": 1, ""B"": 1, ""GR"": 1, ""TR"": 1, ""OT"": 1, ""VL"": 1, ""DJ"": 1, ""GJ"": 1, ""MH"": 1, ""CS"": 1}","MESAJ 4/4
 ATENȚIONARE METEOROLOGICĂ
 
COD GALBEN
 Interval de valabilitate: 1 iulie, ora 12 – 1 iulie, ora 23
 Fenomene vizate: instabilitate atmosferică, averse însemnate cantitativ
 Zone afectate: sudul Banatului, Oltenia, cea mai mare parte a Munteniei și local zona de munte

 

       Miercuri (1 iulie) în sudul Banatului, Oltenia, în cea mai mare parte a Munteniei și local în zona de munte vor fi perioade cu instabilitate atmosferică ce se va manifesta prin averse torențiale, frecvente descărcări electrice, intensificări ale vântului (viteze la rafală în general de 50...70 km/h) și pe arii restrânse vijelii și căderi de grindină de mici și medii dimensiuni (1...4 cm). În intervale scurte de timp (1...3 ore) sau prin acumulare cantitățile de apă vor fi de 15...25 l/mp și pe arii restrânse vor depăși 30...40 l/mp.

 

În funcţie de evoluţia şi intensitatea fenomenelor meteorologice, Administraţia Naţională de Meteorologie va actualiza prezentul mesaj
.","<p align=""center""><span style=""font-size: small; font-family: verdana, geneva; color: #000000;""><strong><span lang=""RO"">MESAJ 4/4<br /> ATENȚIONARE METEOROLOGICĂ<br /> </span></strong></span><img src=""../wp-content/plugins/meteo//admin/images/galben.gif"" alt="""" align=""absmiddle"" /><span style=""font-size: small; font-family: verdana, geneva; color: #000000;""><span lang=""RO""><strong>COD GALBEN<br /> Interval de valabilitate: 1 iulie, ora 12 &ndash; 1 iulie, ora 23<br /> Fenomene vizate: instabilitate atmosferică, averse &icirc;nsemnate cantitativ<br /> Zone afectate: sudul Banatului, Oltenia, cea mai mare parte a Munteniei și local zona de munte</strong></span></span></p>
<p align=""center""><span style=""font-size: small; font-family: verdana, geneva; color: #000000;""><strong><span lang=""RO"">&nbsp;</span></strong></span></p>
<p><span style=""font-size: small; font-family: verdana, geneva; color: #000000;"" lang=""RO"">&nbsp;&nbsp;&nbsp;&nbsp;&nbsp;&nbsp; Miercuri (1 iulie) &icirc;n sudul Banatului, Oltenia, &icirc;n cea mai mare parte a Munteniei și local &icirc;n zona de munte vor fi perioade cu instabilitate atmosferică ce se va manifesta prin averse torențiale, frecvente descărcări electrice, intensificări ale v&acirc;ntului (viteze la rafală &icirc;n general de 50...70 km/h) și pe arii restr&acirc;nse vijelii și căderi de grindină de mici și medii dimensiuni (1...4 cm). &Icirc;n intervale scurte de timp (1...3 ore) sau prin acumulare cantitățile de apă vor fi de 15...25 l/mp și pe arii restr&acirc;nse vor depăși 30...40 l/mp.</span></p>
<p>&nbsp;</p>
<p align=""center""><span style=""font-size: small; font-family: verdana, geneva; color: #000000;""><strong><em><span lang=""RO"">&Icirc;n funcţie de evoluţia şi intensitatea fenomenelor meteorologice, Administraţia Naţională de Meteorologie va actualiza prezentul mesaj</span></em></strong><strong><em><span lang=""RO"">.</span></em></strong></span></p>"
